{
  "schema": "distributed_world_simulator.r3_director_final_gate_result.v1",
  "work_order_id": "GLOBAL-P0-R3-RECOVERED-MAIN-EXACT-REPIN-V9",
  "checkpoint": "R3_REFRESHED_CANDIDATE",
  "risk_class": "CRITICAL",
  "target_head_sha": "595263c4c925c122a09876cb29b87f5ca5fef1d2",
  "control_evidence_head_sha": "42bf39fe3cf28e7d582a011e7bd086b65dc18ea0",
  "director": "DIRECTOR_SOL",
  "verdict": "PASS",
  "decided_at_utc": "2026-08-13T02:29:49Z",
  "evidence_paths": [
    "artifacts/control-global-p0-r3-refresh-r1/contracts/director-final-gate-result.schema.v1.json",
    "config/control/harness/harness-policy.v1.json",
    "config/control/harness/risk-policy.v1.json",
    "config/control/harness/checkpoint-catalog.v1.json",
    "config/control/harness/review-policy.v1.json",
    "config/control/harness/evidence-map.schema.v1.json",
    "config/control/harness/event.schema.v1.json",
    "config/architecture/global-p0-r3-architecture-candidate.v1.json",
    "config/control/architecture-ownership-r3-candidate.v1.json",
    "config/control/global-p0-r2-to-r3-transition-policy.v1.json",
    "config/control/global-p0-r3-prepromotion-guards.v1.json",
    "docs/architecture/GLOBAL_P0_R3_ARCHITECTURE_CANDIDATE_RU.md",
    "docs/plans/H_PRIMARY_EXECUTION_ROADMAP_RU.md",
    "config/control/project-program-registry.v1.json",
    "artifacts/control-global-p0-r3-refresh-r1/post-build-critique-v9.v1.json",
    "artifacts/control-global-p0-r3-refresh-r1/evidence-map.json",
    "config/control/branches/control__global-p0-r3-refresh-r1.v1.json",
    "artifacts/control-global-p0-r3-refresh-r1/reviews/GLOBAL-P0-R3-V9-FINAL-REVIEW-001.v1.json",
    "artifacts/control-global-p0-r3-refresh-r1/verification/GLOBAL-P0-R3-RECOVERED-MAIN-EXACT-REPIN-V9-VERIFIER-001.v1.json",
    "artifacts/control-global-p0-r3-refresh-r1/human-attention-global-architecture-promotion-v9.v1.json",
    "github-actions://rootfabric/distributed-world-simulator/runs/31659423299",
    "github-actions://rootfabric/distributed-world-simulator/artifacts/9165623993/project-control-report.json",
    "github-actions://rootfabric/distributed-world-simulator/artifacts/9165623993/directional-watch-report.json"
  ],
  "predicates": {
    "canonical_main_fresh": true,
    "frozen_target_exact": true,
    "candidate_unchanged": true,
    "reviewer_pass_durable": true,
    "verifier_pass_durable": true,
    "current_project_control_non_red": true,
    "critical_overlap_zero": true,
    "design_brief_substantive": true,
    "architecture_invariants_preserved": true,
    "ownership_preserved": true,
    "director_route_complete": true,
    "human_gate_separate": true,
    "runtime_domain_mutation_zero": true,
    "checkpoint_predicates_sufficient": true,
    "ready_not_predeclared": true,
    "promotion_not_performed": true,
    "merge_not_performed": true
  },
  "required_fixes": [],
  "evidence_gaps": [],
  "risk_assessment": "Independent Director sufficiency review establishes exact canonical main ce40dd075045078ed70924f8d5a1011eb3eff03d, exact frozen V9 target 595263c4c925c122a09876cb29b87f5ca5fef1d2, unchanged candidate blob c569d90b9aa2d4675e8ef30cb524aef5771f1522, durable exact-V9 Reviewer PASS and Verifier PASS, and Project Control 31659423299/#333 SUCCESS with YELLOW/NON_RED global health, zero blocking/current critical overlap and cross_branch_overlaps=[]. The architecture package is substantive and preserves canonical truth ownership: WT compiles to M0 rather than replacing it, WQ owns no canonical store, WB owns no authority, V0 remains presentation/composition-only, H0.3 remains development-control-only, and ITEM/MATTER/CONSTRUCTION/G/NX/AUTHORITY/M0/S1/R3_M0_MW ownership is preserved. Frozen-target and post-freeze changes contain no runtime/domain mutation. G->ECO remains an advisory watch and ECO retains non-global-blocking passport/source-schema hygiene debt; CH->NX remains a future NX source-acceptance revalidation gate. Neither is a current R3 final-gate failure. R3_REFRESHED_CANDIDATE_READY is not predeclared, no architecture promotion or merge has occurred, and the OPEN Human GLOBAL_ARCHITECTURE_PROMOTION gate remains separate. The Director route is complete by this durable Director verdict only; lifecycle roll-forward and Human decision remain outside this role.",
  "summary": "DIRECTOR_FINAL_GATE_PASS: independently inspected checkpoint predicates, architecture and ownership invariants, Reviewer evidence, Verifier evidence, exact-current-main freshness, Project Control, lifecycle state and Human-gate separation are sufficient for the R3 V9 Director final gate. This PASS does not declare R3_REFRESHED_CANDIDATE_READY, does not remove Director/Human lifecycle blockers, does not authorize or represent Human GLOBAL_ARCHITECTURE_PROMOTION, and does not authorize or perform merge."
}
